{
  "allowed_files": [
    ".agent/",
    "docs/ai/",
    "fixture.txt"
  ],
  "blocked_files": [],
  "design_decisions": [
    {
      "id": "DD-FIXTURE",
      "references": [
        "docs/golem-integration.md"
      ],
      "text": "Keep design guidance inside the locked plan."
    }
  ],
  "drift_budget": {
    "architecture_drift": "requires_approval",
    "formatting_drift": "minimal",
    "new_dependencies": 0,
    "test_weakening": 0,
    "unrelated_edits": 0
  },
  "evidence_ids": [],
  "invariants": [
    "All generated proof artifacts come from the current Agentflow CLI."
  ],
  "locked": true,
  "locked_at": "2026-07-22T01:17:14+00:00",
  "non_goals": [
    "Exercise aggregation; that has a separate fixture."
  ],
  "objective": "Build a full-featured current proof compatibility fixture.",
  "requirements": [
    {
      "acceptance_criteria": [
        {
          "id": "AC-FIXTURE",
          "text": "The fixture command exits zero."
        }
      ],
      "id": "REQ-FIXTURE",
      "text": "The fixture records a successful command criterion."
    }
  ],
  "risk_level": "low",
  "rollback_plan": "Delete and regenerate the fixture root.",
  "schema_version": "1.0.0",
  "scope": [
    "Exercise criterion, design-reference, capability, runtime, review, amendment, and hunk proof blocks."
  ],
  "steps": [
    {
      "action": "Create and amend fixture.txt.",
      "criterion_ids": [
        "AC-FIXTURE"
      ],
      "design_decision_ids": [
        "DD-FIXTURE"
      ],
      "evidence_ids": [],
      "expected_diff": [
        "fixture.txt contains two generated lines."
      ],
      "files": [
        "fixture.txt"
      ],
      "gates": [
        {
          "criterion_ids": [
            "AC-FIXTURE"
          ],
          "kind": "command",
          "run": [
            "/usr/bin/python3",
            "-c",
            "pass"
          ]
        }
      ],
      "id": "P1",
      "preconditions": [
        "Plan and workflow contract are locked."
      ],
      "validation": [
        "/usr/bin/python3 -c pass"
      ]
    }
  ],
  "validation_gates": [
    "/usr/bin/python3 -c pass"
  ]
}
